description,compensation
Humedad leve (pequeñas manchas o manchas superficiales),"500€ - 2,500€"
"Humedad moderada (manchas visibles, pero sin daños estructurales)","1,000€ - 5,000€"
"Humedad severa (daños a paredes, techos o muebles)","3,000€ - 10,000€"
"Humedad extrema (infiltración de agua significativa, daños estructurales graves)","6,000€ - 25,000€"
Humedad por filtraciones en sótano (daños en cimientos o estructura),"4,000€ - 15,000€"
Madera afectada por humedad (degradación o pudrición),"2,000€ - 10,000€"
Moho o hongos debido a humedad persistente),"1,000€ - 8,000€"
